{
  "$schema": "https://json-schema.org/draft/2020-12/schema",
  "$id": "https://courseDeveloperStudio/contracts/generation-job/result.schema.json",
  "title": "GenerationJob result manifest — academy-brain.generate-session",
  "description": "Shape of GenerationJobExecutionResult.ResultManifest on success for operation 'academy-brain.generate-session' (STEP 5). studioBuild.commitSha is the Studio repo commit CourseDeveloper.Worker ran under — per DEC-004 there is no separate academy-brain release to pin, so this replaces that idea. pedagogy is academy-brain's real pedagogy-coverage gate output (00-contracts/pedagogy.md §5), sourced by generate_session.pedagogy_summary() — never a guess — and is the DEC-005 transformation-summary evidence STEP 8's customer-facing receipt reads.",
  "type": "object",
  "additionalProperties": false,
  "required": ["contractVersion", "studioBuild", "sessionId", "exitCode", "pedagogy"],
  "properties": {
    "contractVersion": { "const": 1 },
    "studioBuild": {
      "type": "object",
      "additionalProperties": false,
      "required": ["commitSha"],
      "properties": {
        "commitSha": { "type": "string", "minLength": 7, "description": "Studio monorepo commit the worker/academy-brain subprocess ran under." }
      }
    },
    "sessionId": { "type": "string", "pattern": "^L\\d+-s\\d+$" },
    "exitCode": { "type": "integer", "description": "generate_session.py's process exit code. 0 = success (or a clean dry run). 2 = HardStop (a gate refused; see stderrTail)." },
    "stdoutTail": { "type": "string", "description": "Last N lines of the subprocess's stdout, for operator diagnosis. Not the full log — that belongs to the worker's own log sink." },
    "stderrTail": { "type": "string" },
    "receiptPath": {
      "type": ["string", "null"],
      "description": "Path to the .production.yaml receipt generate_session.write_receipt() wrote, when live=true and the run succeeded. Null for a dry run. This is a path on the worker's local disk — see artifactStorage for the Studio-visible, durable copy."
    },
    "artifactStorage": {
      "type": "object",
      "additionalProperties": false,
      "required": ["bucket", "path", "sha256", "sizeBytes"],
      "description": "STEP 6: where the receipt at receiptPath was durably uploaded (Supabase Storage), so it survives past the worker's own local job workspace. Absent for a dry run and absent when the worker has no durable storage configured (e.g. local dev) — receiptPath is then the only location.",
      "properties": {
        "bucket": { "type": "string", "minLength": 1 },
        "path": { "type": "string", "minLength": 1, "description": "Object key within the bucket, e.g. '<jobId>/<filename>'." },
        "sha256": { "type": "string", "pattern": "^[0-9a-f]{64}$" },
        "sizeBytes": { "type": "integer", "minimum": 0 }
      }
    },
    "courseBundleStorage": {
      "type": "object",
      "additionalProperties": false,
      "required": ["bucket", "path", "sha256", "sizeBytes"],
      "description": "STEP 6: where the zipped generated course output (VAULT/75-bundle/<sessionId> — the actual slides/assets, distinct from the small receipt file) was durably uploaded. Absent for a dry run, when the bundle directory doesn't exist, or when durable storage isn't configured.",
      "properties": {
        "bucket": { "type": "string", "minLength": 1 },
        "path": { "type": "string", "minLength": 1, "description": "Object key within the bucket, e.g. '<jobId>/<sessionId>-<jobId>.zip'." },
        "sha256": { "type": "string", "pattern": "^[0-9a-f]{64}$" },
        "sizeBytes": { "type": "integer", "minimum": 0 }
      }
    },
    "generatedPdfStorage": {
      "type": "object",
      "additionalProperties": false,
      "description": "Durable locations for the generated PDFs that exist after the live run and any content-quality regeneration. Absent for a dry run, when no generated PDF exists, or when durable storage is not configured.",
      "properties": {
        "deck-a": { "$ref": "#/$defs/uploadedArtifact" },
        "deck-b": { "$ref": "#/$defs/uploadedArtifact" },
        "summary": { "$ref": "#/$defs/uploadedArtifact" }
      }
    },
    "promptProvenance": {
      "type": ["object", "null"],
      "additionalProperties": false,
      "required": ["path", "sha256"],
      "description": "The prompt file selected for this run and the SHA-256 of the exact bytes parsed by generate_session.py. Present for official live and dry runs; null is retained for compatibility with older or hand-written RESULT_JSON producers.",
      "properties": {
        "path": { "type": "string", "minLength": 1 },
        "sha256": { "type": "string", "pattern": "^[0-9a-f]{64}$" }
      }
    },
    "pedagogy": {
      "type": "object",
      "additionalProperties": false,
      "required": ["gate", "verdict", "detail"],
      "properties": {
        "gate": { "const": "pedagogy-coverage" },
        "verdict": { "enum": ["PASS", "FAIL", "UNVERIFIED"] },
        "detail": { "type": "string" },
        "evidence": { "type": "object" }
      },
      "description": "Real gates.REGISTRY['pedagogy-coverage'] output for sessionId's level. UNVERIFIED with a plain reason if that level has no pedagogy record yet (00-contracts/pedagogy.md §5) — never fabricated."
    }
  },
  "$defs": {
    "uploadedArtifact": {
      "type": "object",
      "additionalProperties": false,
      "required": ["bucket", "path", "sha256", "sizeBytes"],
      "properties": {
        "bucket": { "type": "string", "minLength": 1 },
        "path": { "type": "string", "minLength": 1 },
        "sha256": { "type": "string", "pattern": "^[0-9a-f]{64}$" },
        "sizeBytes": { "type": "integer", "minimum": 0 }
      }
    }
  }
}
